{
  "category": {
    "additional": [
      "API_addition"
    ],
    "basis": "source_text_vocabulary_match",
    "matched_phrase": "deprecated",
    "value": "deprecation"
  },
  "change_record": {
    "canonical_url": "https://www.drupal.org/node/3348027",
    "created_at": "2026-09-07T08:30:57Z",
    "introduced_branch": "11.5.x",
    "introduced_version": "11.5.0",
    "node_id": "3348027",
    "published": true,
    "title": "user_role_grant_permissions(), user_role_revoke_permissions() and user_role_change_permissions() are deprecated"
  },
  "description": {
    "excerpt": "The following functions have been deprecated: user_role_grant_permissions() user_role_revoke_permissions() user_role_change_permissions() RoleInterface has three new methods to replace the functions. grantPermissions changePermissions revokePermissions It is important to use the loadOverrideFree method when interacting with permissions. Before: user_role_grant_permissions(RoleInterface::ANONYMOUS_ID, [ 'access comments', 'post comments', 'skip comment approval', ]); After: Role::loadOverrideFree(RoleInterface::ANONYMOUS_ID)->grantPermissions([ 'access comments', 'post comments', 'skip comment ",
    "present": true,
    "text_length": 1168
  },
  "id": "change-record.3348027",
  "is_general_knowledge_record": false,
  "is_trusted_knowledge": false,
  "provenance": {
    "acquisition_channel": "external_authoritative_source",
    "authority_kind": "change_record_feed",
    "ingest_run_id": "api.20260908T231021.6bf7c3e6",
    "ingested_at": "2026-09-08T23:10:21Z",
    "ingested_by": {
      "name": "drupal-knowledge-api-lifecycle-engine",
      "version": "0.1"
    },
    "source_id": "drupal-core-change-notices",
    "source_node_id": "3348027",
    "source_snapshot_sha256": "sha256:2f00fe48197087de210c09af8fd203f08a62d338889e68875b69ee621bcf44eb",
    "source_url": "https://www.drupal.org/list-changes/drupal"
  },
  "record_class": "source_derived_authoritative_api_lifecycle_record",
  "record_contract_version": "0.1",
  "symbols": {
    "extraction": "title_call_syntax_only",
    "lifecycle_asserted": false,
    "named_with_call_syntax": [
      "user_role_change_permissions",
      "user_role_grant_permissions",
      "user_role_revoke_permissions"
    ],
    "semantics": "A change record names symbols. It does not, in this contract, assert their lifecycle; that comes from the deprecation index."
  }
}
