{
  "category": {
    "additional": [
      "service_change"
    ],
    "basis": "source_text_vocabulary_match",
    "matched_phrase": "deprecated",
    "value": "deprecation"
  },
  "change_record": {
    "canonical_url": "https://www.drupal.org/node/3587768",
    "created_at": "2026-09-04T18:00:49Z",
    "introduced_branch": "11.5.x",
    "introduced_version": "11.5.0",
    "node_id": "3587768",
    "published": true,
    "title": "Functions in update.compare.inc are deprecated"
  },
  "description": {
    "excerpt": "The following functions have been deprecated: update_process_project_info update_calculate_project_data update_calculate_project_update_status Before: update_calculate_project_data($available) After: \\Drupal::service(UpdateManagerInterface::class)->calculateProjectData($available) The UpdateCalculator service is internal. Before: update_process_project_info(&$projects) After: \\Drupal::service(UpdateCalculator::class)->processProjectInfo($projects) Before: update_calculate_project_update_status(&$project_data, $available) After: $project_data = \\Drupal::service(UpdateCalculator::class) ->update",
    "present": true,
    "text_length": 904
  },
  "id": "change-record.3587768",
  "is_general_knowledge_record": false,
  "is_trusted_knowledge": false,
  "provenance": {
    "acquisition_channel": "external_authoritative_source",
    "authority_kind": "change_record_feed",
    "ingest_run_id": "api.20260908T231021.6bf7c3e6",
    "ingested_at": "2026-09-08T23:10:21Z",
    "ingested_by": {
      "name": "drupal-knowledge-api-lifecycle-engine",
      "version": "0.1"
    },
    "source_id": "drupal-core-change-notices",
    "source_node_id": "3587768",
    "source_snapshot_sha256": "sha256:2f00fe48197087de210c09af8fd203f08a62d338889e68875b69ee621bcf44eb",
    "source_url": "https://www.drupal.org/list-changes/drupal"
  },
  "record_class": "source_derived_authoritative_api_lifecycle_record",
  "record_contract_version": "0.1",
  "symbols": {
    "extraction": "title_call_syntax_only",
    "lifecycle_asserted": false,
    "named_with_call_syntax": [],
    "semantics": "A change record names symbols. It does not, in this contract, assert their lifecycle; that comes from the deprecation index."
  }
}
