{
  "category": {
    "additional": [],
    "basis": "source_text_vocabulary_match",
    "matched_phrase": "new method",
    "value": "API_addition"
  },
  "change_record": {
    "canonical_url": "https://www.drupal.org/node/3620269",
    "created_at": "2026-09-04T17:49:04Z",
    "introduced_branch": "11.5.x",
    "introduced_version": "11.5.0",
    "node_id": "3620269",
    "published": true,
    "title": "ConfigEntityBase now has static helpers for loadOverrideFree and loadMultipleOverrideFree"
  },
  "description": {
    "excerpt": "ConfigEntityBase now has two new static helpers to load override free versions of their entities. ConfigEntityBase::loadOverrideFree ConfigEntityBase::loadMultipleOverrideFree These will load config entities without overrides (no translations, per domain or other contextual changes) and should be used whenever a config entity is loaded for the purpose of editing/saving. $role = Role::loadOverrideFree($id); $role->grantPermission('access content'); $role->save(); This is equivalent to the existing method on config entity storage: $storage = \\Drupal::entityTypeManager()->getStorage('role'); asse",
    "present": true,
    "text_length": 945
  },
  "id": "change-record.3620269",
  "is_general_knowledge_record": false,
  "is_trusted_knowledge": false,
  "provenance": {
    "acquisition_channel": "external_authoritative_source",
    "authority_kind": "change_record_feed",
    "ingest_run_id": "api.20260908T231021.6bf7c3e6",
    "ingested_at": "2026-09-08T23:10:21Z",
    "ingested_by": {
      "name": "drupal-knowledge-api-lifecycle-engine",
      "version": "0.1"
    },
    "source_id": "drupal-core-change-notices",
    "source_node_id": "3620269",
    "source_snapshot_sha256": "sha256:2f00fe48197087de210c09af8fd203f08a62d338889e68875b69ee621bcf44eb",
    "source_url": "https://www.drupal.org/list-changes/drupal"
  },
  "record_class": "source_derived_authoritative_api_lifecycle_record",
  "record_contract_version": "0.1",
  "symbols": {
    "extraction": "title_call_syntax_only",
    "lifecycle_asserted": false,
    "named_with_call_syntax": [],
    "semantics": "A change record names symbols. It does not, in this contract, assert their lifecycle; that comes from the deprecation index."
  }
}
