{
  "category": {
    "additional": [
      "API_addition",
      "hook_change"
    ],
    "basis": "source_text_vocabulary_match",
    "matched_phrase": "new argument",
    "value": "signature_change"
  },
  "change_record": {
    "canonical_url": "https://www.drupal.org/node/3572245",
    "created_at": "2026-09-07T16:37:17Z",
    "introduced_branch": "11.5.x",
    "introduced_version": "11.5.0",
    "node_id": "3572245",
    "published": true,
    "title": "MarkFutureUpdateEquivalent attribute added to register equivalent updates on site install"
  },
  "description": {
    "excerpt": "The attribute Drupal\\Core\\Update\\Attribute\\MarkFutureUpdateEquivalent has been added to make it possible to register hook_update_N implementations as equivalent during module install. Previously, registering updates as equivalent was only possible during module updates, because hook_update_N implementations do not run on module install. Applying the MarkFutureUpdateEquivalent attribute to the hook_update_N function will the register equivalent updates during both module install and update. The hook_update_N itself can be a no-op. If your site uses Drupal\\Core\\Update\\UpdateHookRegistry::markFut",
    "present": true,
    "text_length": 1536
  },
  "id": "change-record.3572245",
  "is_general_knowledge_record": false,
  "is_trusted_knowledge": false,
  "provenance": {
    "acquisition_channel": "external_authoritative_source",
    "authority_kind": "change_record_feed",
    "ingest_run_id": "api.20260908T231021.6bf7c3e6",
    "ingested_at": "2026-09-08T23:10:21Z",
    "ingested_by": {
      "name": "drupal-knowledge-api-lifecycle-engine",
      "version": "0.1"
    },
    "source_id": "drupal-core-change-notices",
    "source_node_id": "3572245",
    "source_snapshot_sha256": "sha256:2f00fe48197087de210c09af8fd203f08a62d338889e68875b69ee621bcf44eb",
    "source_url": "https://www.drupal.org/list-changes/drupal"
  },
  "record_class": "source_derived_authoritative_api_lifecycle_record",
  "record_contract_version": "0.1",
  "symbols": {
    "extraction": "title_call_syntax_only",
    "lifecycle_asserted": false,
    "named_with_call_syntax": [],
    "semantics": "A change record names symbols. It does not, in this contract, assert their lifecycle; that comes from the deprecation index."
  }
}
