{
  "category": {
    "additional": [],
    "basis": "source_text_vocabulary_match",
    "matched_phrase": null,
    "value": "other"
  },
  "change_record": {
    "canonical_url": "https://www.drupal.org/node/3615213",
    "created_at": "2026-09-03T18:22:00Z",
    "introduced_branch": "12.0.x",
    "introduced_version": "12.0.0",
    "node_id": "3615213",
    "published": true,
    "title": "PostgreSQL merge query executes as a single native merge query"
  },
  "description": {
    "excerpt": "PostgreSQL merge queries now execute as a single native MERGE statement On PostgreSQL, $connection->merge($table)->...->execute() now runs one native MERGE statement. Before this change, the driver used the generic emulation: a SELECT followed by an INSERT or an UPDATE. The native statement uses RETURNING merge_action() to report the action taken. Return values are unchanged: Merge::STATUS_INSERT , Merge::STATUS_UPDATE , or NULL when the row existed and no update was requested. Modules need no code changes. The generic emulation is still used when: the condition targets a table other than the ",
    "present": true,
    "text_length": 1006
  },
  "id": "change-record.3615213",
  "is_general_knowledge_record": false,
  "is_trusted_knowledge": false,
  "provenance": {
    "acquisition_channel": "external_authoritative_source",
    "authority_kind": "change_record_feed",
    "ingest_run_id": "api.20260908T231021.6bf7c3e6",
    "ingested_at": "2026-09-08T23:10:21Z",
    "ingested_by": {
      "name": "drupal-knowledge-api-lifecycle-engine",
      "version": "0.1"
    },
    "source_id": "drupal-core-change-notices",
    "source_node_id": "3615213",
    "source_snapshot_sha256": "sha256:2f00fe48197087de210c09af8fd203f08a62d338889e68875b69ee621bcf44eb",
    "source_url": "https://www.drupal.org/list-changes/drupal"
  },
  "record_class": "source_derived_authoritative_api_lifecycle_record",
  "record_contract_version": "0.1",
  "symbols": {
    "extraction": "title_call_syntax_only",
    "lifecycle_asserted": false,
    "named_with_call_syntax": [],
    "semantics": "A change record names symbols. It does not, in this contract, assert their lifecycle; that comes from the deprecation index."
  }
}
