{
  "category": {
    "additional": [],
    "basis": "source_text_vocabulary_match",
    "matched_phrase": null,
    "value": "other"
  },
  "change_record": {
    "canonical_url": "https://www.drupal.org/node/3620430",
    "created_at": "2026-09-02T12:49:32Z",
    "introduced_branch": "12.0.x",
    "introduced_version": "12.0.0",
    "node_id": "3620430",
    "published": false,
    "title": "Node reference fields can include unpublished nodes the user may view"
  },
  "description": {
    "excerpt": "Node reference fields have a new setting, \"Include unpublished nodes the user has access to view\". It is off by default, so nothing changes for existing fields. Before, these fields only matched published nodes unless the user had the \"Bypass content access control\" permission. A user who was allowed to view unpublished nodes still could not reference them. When the setting is on, the nodes a user can reference follow the permissions they already have: \"View any unpublished content\": any unpublished node. \"View own unpublished content\": their own unpublished nodes. Neither: published nodes onl",
    "present": true,
    "text_length": 888
  },
  "id": "change-record.3620430",
  "is_general_knowledge_record": false,
  "is_trusted_knowledge": false,
  "provenance": {
    "acquisition_channel": "external_authoritative_source",
    "authority_kind": "change_record_feed",
    "ingest_run_id": "api.20260908T231021.6bf7c3e6",
    "ingested_at": "2026-09-08T23:10:21Z",
    "ingested_by": {
      "name": "drupal-knowledge-api-lifecycle-engine",
      "version": "0.1"
    },
    "source_id": "drupal-core-change-notices",
    "source_node_id": "3620430",
    "source_snapshot_sha256": "sha256:2f00fe48197087de210c09af8fd203f08a62d338889e68875b69ee621bcf44eb",
    "source_url": "https://www.drupal.org/list-changes/drupal"
  },
  "record_class": "source_derived_authoritative_api_lifecycle_record",
  "record_contract_version": "0.1",
  "symbols": {
    "extraction": "title_call_syntax_only",
    "lifecycle_asserted": false,
    "named_with_call_syntax": [],
    "semantics": "A change record names symbols. It does not, in this contract, assert their lifecycle; that comes from the deprecation index."
  }
}
